fonte,text
NBCNEWS,"Sean “Diddy” Combs, the onetime global hip-hop titan whosefederal trialunveiled harrowing testimony accusing him of sexual abuse against women and forced drug-dazed “freak offs,” wasacquitted Wednesdayof racketeering conspiracy and sex trafficking but found guilty of lesser charges. The jury’s verdict, delivered on the third day of deliberations, declared Combs, 55, not guilty of one count of racketeering conspiracy and two counts of sex trafficking by force, fraud or coercion but guilty of two counts of transportation to engage in prostitution. Later Wednesday, U.S. District Judge Arun Subramanian denied Combs' bail request, saying it would be impossible for him to prove he does not pose a danger. The verdict is seen as a win for Combs and his defense team, which did not call a single witness during the seven-week trial. After it was read, his family stood in the background, clapping and cheering. Combs fell to his knees in prayer. As he left the courtroom, he told his family, “Thank you, love you.” Teny Geragos,one of Combs’ attorneys,broke out in tears. His lead attorney, Marc Agnifilo, made a fist in triumph as the defense team hugged one another and hugged his family. “It’s a great victory for Sean Combs,"" Agnifilo told reporters outside the courthouse. ""It’s a great victory for the jury system. You saw that the Southern District of New York prosecutors came at him with all that they had.” Agnifilo had asked Subramanian to release Combs from federal detention, where he has been for nearly a year. He also asked for Combs to be released on conditions to his home in Miami, offering a $1 million bond. Combs has been a “model prisoner” who is “in the process of working on himself” and has no plans to flee, Agnifilo said. In his denial, Subramanian cited Combs' attorneys’ own words — “we own the domestic violence"" — and said prosecutors had presented evidence that Combs had ""engaged in years of lifelong violence."" ""He continues to be a danger to others,"" Subramanian said. Subramanian set a sentencing date of Oct. 3. Prosecutors are seeking between four and five years behind bars, the judge said. Combs' family, including his mother and his son Justin Combs, left the courthouse shortly after the verdict. A crowd of supporters swarmed the family’s waiting van, shouting, “Free Puff! Free Puff! Free Puff!” His mother, Janice Combs, later returned to the courthouse, waving to onlookers and fans and blowing kisses. Outside court, Combs' supporters celebrated with baby oil, an apparent reference to supplies witnesses said were provided for ""freak offs."" A woman in a bikini danced as a man drizzled baby oil on her from a nearby ledge. Amid the throngs of onlookers were the influencers who have been chronicling the trial from the courthouse since it began roughly two months ago. Los Angeles-based YouTuber Armon Wiggins, who has more than 285,000 followers, declined to share his thoughts about the verdict itself but acknowledged a victory of a different sort. “We changed the face of media. We changed the face of how news gets out,” Wiggins said. “It was a fight in the beginning, because a lot of times people don’t respect the new media, but I’m one of those people who’s willing to fight with the traditional media because we do numbers.” The trial has drawn nationwide attention. No cameras were allowed in court, so to follow along with what was happening in the courtroom, people turned to traditional media sources, as well as influencers who were at the trial. Wiggins said that since he began covering the trial, he’s gained about 60,000 new followers on YouTube and nabbed several radio and TV appearances, including on TMZ and NewsNation. The partial conviction caps an astonishing moment for Combs, a self-made rapper from New York who rose to the pinnacle of hip-hop culture and became a household name. He once ruled the hip-hop and R&B charts and was a fixture in celebrity circles, propelled by his exuberant personality, lavish lifestyle and business pursuits — including reality television and fashion — as an entrepreneur and brand ambassador. After a three-decade run in the spotlight, allegations by his ex-girlfriend the R&B singer Cassie began his precipitous fall from impresario to convicted criminal. Over the course of the trial, a jury of eight men and four women heard the U.S. government accuse Combs, the founder of Bad Boy Records, of leveraging hispower, wealth and influenceas the head of a “criminal enterprise” to sexually abuse and exploit women for his own gratification over two decades. His defense pitched to jurors that the case was “badly exaggerated” and that he was on trial simply for a “swingers” lifestyle — one tinged with violent behavior and supplies of drugs and baby oil — that was ultimately consensual. Jurors heard from almost three dozen government witnesses, from former personal assistants to stylists to label artists. Some willingly testifying against Combs, while others were granted immunity in exchange for their testimony. Three women, includingCassie, whose real name is Casandra Ventura, were central figures in the case. They provided graphic testimony about allegations of sexual assault and violence or threats of blackmail. Combs’lawyers called no witnesses,and Combs himself decided not to testify, as much of the defense’s case was laid out during lengthy cross-examinations of government witnesses. Ventura’s attorney, Doug Wigdor, told reporters outside the courthouse Wednesday that his team would have liked to have seen a conviction on the sex crimes and racketeering charges but that they were pleased he has “finally been held accountable” and faces substantial jail time on the lesser charges. On the racketeering conspiracy charge, a jury must be convinced beyond a reasonable doubt that a defendant was involved in an enterprise among two or more people to engage in at least two criminal acts affecting interstate commerce — offenses that may include kidnapping, arson, bribery, forced labor, sex trafficking and other underlying crimes. For the standalone sex trafficking charge, prosecutors must demonstrate the defendant by force or threat compelled others to commit commercial sex acts in which something of value, such as money, was received. During her nearly five-hour closing argument, Assistant U.S. Attorney Christy Slavik reminded the jury about various government witnesses who testified about the allegations. She said an ex-assistant of Combs’,Capricorn Clark, was subjected to kidnapping and forced labor, while the car of a romantic rival of Combs,the rapper Kid Cudi, was firebombed in an act of arson. A former assistant who testified under thepseudonym “Mia”and accused Combs of sexually assaulting her multiple times was another example of forced labor, Slavik said. On the two sex trafficking counts, Slavik told jurors that they did not need to believe Ventura or another ex-girlfriend, who testified under the pseudonym “Jane,” were engaged in sex acts against their will in every instance. The women testified about ""freak offs"" and “hotel nights,” which were the names for drug-induced sexual encounters with male escorts they said Combs routinely manipulated them into under threat of releasing recorded videos of the explicit sex acts. “So, if there was one time, one single freak off, when the defendant knew or recklessly disregarded that Cassie or Jane was participating because of his lies, his threats or his violence, then that’s it,” Slavik said, “he’s guilty.” Combs’ defense team maintained that he operated a legitimate business and was being unfairly targeted by overzealous prosecutors. “Sean Combs has become something that is very, very hard to become, very hard to be,” Agnifilo said in his four-hour closing arguments. “He is a self-made successful Black entrepreneur.” While Agnifilo didn’t deny that Combs was consumed by bouts of jealousy and that he engaged in angry tirades that involved domestic violence, the women, ultimately, chose to stay with him, while those in his inner circle had the agency to leave, he said. “If racketeering conspiracy had an opposite, it would be their relationship,” Agnifilo said of Combs and Ventura, who dated on and off from about 2007 to 2018. One key piece of evidence played for the jury repeatedly and frame by frame was security video showing Combs physically assaulting Ventura in a Los Angeles hotel hallway in 2016.She testifiedthat he was angered because she was trying to leave a freak off. “We own the domestic violence. We own it. I hope you guys know this,” Agnifilo told the jury while denying Combs was a mastermind who conspired with his employees to commit crimes. No matter the outcome of the criminal case, Combs must contend with aslew of lawsuitsthat have included accusations of rape and sexual assault.Combs, who has denied such allegations, has accused various plaintiffs of pursuing quick “paydays.” Adam Reiss is a reporter and producer for NBC and MSNBC. Erik Ortiz is a senior reporter for NBC News Digital focusing on racial injustice and social inequality. Katherine Koretski is a producer in the New York bureau."
ABC,"Sean ""Diddy"" Combs reacts to being convicted of prostitution-related offences but acquitted of sex trafficking and racketeering charges.(AP: Elizabeth Williams) In the hours after the jury handed down its verdict in Sean ""Diddy"" Combs's federal court case, a video began to circulate online. It shows a group gathered outside the Manhattan courthouse. Some throw their hands up, others dance, and one squirts a bottle of baby oil on another. They appear to be celebrating Combs — who at the end of 2024 was indicted on US federal charges following a slew of civil lawsuits — being found not guilty of racketeering and sex trafficking, greatly reducing his potential jail time. On July 4, after weeks of trial testimony, including an emotional statement from a heavily pregnantCassie Ventura— who settled a civil suit against her former partner Combs last year — a jury delivered its finding. The 55-year-old was guilty of two counts of transportation to engage in prostitution, his least serious charges. Combs was found not guilty on two counts of sex trafficking by force, fraud or coercion, and on one count of racketeering conspiracy. He will be sentenced in October. For the fans that gathered outside of the courthouse, it was as good as a victory. Some yelled ""free Diddy"" as othersrushed to supply the abundant news cameraswith sound bites claiming all the charges against Combs should have been struck off. The response from fans shows a path forward for the celebrity despite him being convicted of a serious crime. There's something unique about being more than just a casual fan of an artist, according to Bertha Chin, an expert in fandom subculture and a senior lecturer in media and cultural studies at Singapore National University. A strong sense of what feels like a reciprocal connection with a celebrity — otherwise known as a parasocial relationship — can lead to fans being not only engaged with an artist's work, but also ""involved in the politics"", she told ABC Entertainment. In recent years, parasocial relationships have become increasingly prevalent — in part because celebrities are nurturing them. One of Sean Combs's supporters outside the courthouse during his federal trial in May.(Reuters: David 'Dee' Delgado) ""We're saturated with choices, so it's all the more important for artists and celebrities to develop a relationship with their fans. It's a mutually beneficial relationship,"" Dr Chin said. ""Artists are promoting their latest projects or themselves, whereas fans inherently see themselves being represented by the artists, or want to achieve something towards emulating said artists."" And in that relationship, there can be a blurry line between a fan defending an artist and willingly ignoring an artist's bad, or illegal, behaviour altogether. ""There's been a lot of discussions … on whether fans should separate the creator from the art, that continuing to support the media does not necessarily mean that they are also supporting the actions of its creators,"" Dr Chin said. ""It's a complex emotion, and I'd say some fans are more successful at separating the creator from the creative works than others."" Fans sticking by their favourite artists even after they have been convicted of a violent crime is not unheard of. A day before Combs's verdict was handed down, thousands of music fans were lining up outside Glasgow's 50,000-plus capacity Hampden Park stadium to see Chris Brown live in concert. Chris Brown walks outside Southwark Crown Court in London, where he was charged with grievous bodily harm following a 2023 incident.(Reuters: Isabel Infantes) After a string of mid-2000s hit songs, Brown was charged with attacking his then-girlfriend Rihanna in 2009. He pleaded guilty to felony assault over the incident, accepting a plea deal that gained him five years of probation, community service and domestic violence training. Brown has facednumerous legalissues inthe years since his 2009 conviction,including an assault charge this past May. He also caused controversy in June when he posed with his hands around theneck of a female fan during a meet-and-greet. When local news outlet STV questioned the anticipatory fans waiting outside Hampden Park, some said they had no knowledge of the incident at all, some said he had changed, and one woman said she loves a ""bad boy"". ""Both Sean Combs and Chris Brown exert a very particular kind of hyper-masculine trait that attracts a very specific type of fan,"" Dr Chin said. ""Certain artists will attract a specific kind of following based on their image or branding … It's not really about the parasocial relationships as such, but more what fans see and understand an artist represents."" Following his trial, Combs was denied bail, which means he will stay behind bars at least until his sentencing in October. After his sentence is handed down, Combs will have the option to appeal against his conviction or the sentence. Outside of the federal case, Combs is still facing 66 civil lawsuits that accuse him of sexual assault, false imprisonment, battery andmore. A relieved Sean Combs claps his hands in court and tells his family he will be home soon, but the matter is not over yet. Speaking to theAssociated Press, Evan Nierman, CEO and president of crisis public relations firm Red Banyan, said he saw a path for Combs to emerge relatively unscathed, despite all of the accusations. ""This is a very positive outcome overall for him. And it does give him an opportunity to try to rebuild his life,"" Mr Nierman said. ""It won't be the same, but at least he's likely going to be out there in the world and able to move forward."" While each of Combs's convicted charges carry a maximum sentence of 10 years, the prosecution has pointed tosentencing guidelinesthat appear to recommend a prison term of a little more than five years. Combs's lawyers say the sentence should be a maximum of two years, with time served on account of music star being behind bars for more than a year. ""It's a powerful thing for the hip hop mogul to go public …that the feds tried to come after him and they failed,"" Mr Nierman said. ""I could definitely see him leaning into that."" We acknowledge Aboriginal and Torres Strait Islander peoples as the First Australians and Traditional Custodians of the lands where we live, learn, and work. AEST= Australian Eastern Standard Time which is 10 hours ahead of GMT (Greenwich Mean Time)"
CBSNEWS,"Sean ""Diddy"" Combs was found guilty Wednesday of transportation to engage in prostitution in his federal trial in New York City, but the music mogul was acquitted of the more severe charges of racketeering conspiracy and sex trafficking. Combs willremain in detention while he awaits his sentencing. Judge Arun Subramanian said later Wednesday he denied bail because he disagreed with the defense's argument that the crimes shouldn't trigger mandatory detention. Combs will get 10 months credit for time served so far, the judge said, proposing a sentencing date of Oct. 3. Combs was convicted of two counts of the prostitution-related charge. Each count carries a maximum sentence of 10 years in prison. Prosecutors said their preliminary calculations indicate Combs should get at least 51 to 63 months imprisonment on the two convictions, or asentenceof roughly four to five years. As the jury foreperson announced not guilty on the racketeering conspiracy and sex trafficking charge involving Combs' former girlfriend, Casandra Ventura — the R&B singer known as Cassie — Combs put his hand to his face, his fingers resting on his temples. When he heard the word ""guilty"" for Count 3, the first prostitution-related charge, he was startled. But then ""not guilty"" came for the second sex trafficking count involving another former girlfriend who testified under the pseudonym ""Jane."" Combs held hands with attorney Teny Geragos and leaned in to talk to her. Combs looked at his family and made prayer hands. He nodded as each juror affirmed the verdict, shaking his fists triumphantly under the table. He made prayer hands to the jury, hugged Geragos and smiled. He mouthed ""thank you"" to attorney Marc Agnifilo. Combs turned to his family, clasped his hands together and appeared to say: ""I'm coming home."" He looked toward the reporters in the courtroom and again shook his fist under the table. Combs leaned forward and nodded in agreement at the jury as the judge thanked them. He then put his face in his hands and smiled. Combs made prayer hands and mouthed ""thank you"" to the jurors a number of times. Then he clasped his hands and kept thanking them. He leaned back and tilted his head up, again putting his face in his hands as though in disbelief. Combskneeled down on the ground, put his hands on his chair and prayed. He and his family erupted in loud applause, cheering loudly and whistling. Following the decision, Combs' lawyers argued for him to be released from custody immediately and be able to return to his Miami home, emphasizing that this was his first conviction. Prosecutors opposed the defense's request and urged Judge Arun Subramanian to keep Combs detained until his sentencing. Subramanian acknowledged that Combs didn't want to return to a federal detention center in Brooklyn where he'd been in custody since his arrest last September. Combs shook his head no. The judge asked both the prosecution and defense to submit letters as to why Combs should be released Wednesday or remain detained. Combs' attorneys proposed in their letter that a million-dollar bond be posted for him and that his travel be restricted to parts of Florida, California, New York and New Jersey. New Jersey and New York were included to accommodate Combs traveling to attend court and meet with his attorneys. Combs' attorneys also proposed surrendering his passport and undergoing drug testing when required by the court. Prosecutors proposed that Combs continued to be detained and his bail application be denied. The developments come after jurors said Tuesday they'd agreed on four of the five counts against Combs but disagreed on racketeering conspiracy. They reached a verdict on all five counts Wednesday morning. Jurorsbegan deliberatingin U.S. District Court in lower Manhattan on Monday. They said they'dreached a partial verdictTuesday, but Subramanian sent them back to continue deliberating on the remaining count. The grand jury indictment against the 55-year-old Combs, unsealed in September 2024, initially charged the hip-hop mogul with three counts following hisarrestat a Manhattan hotel. In April, before the trial began, prosecutors filedadditional charges, bringing the total number of counts against him to five. Combspleaded not guiltyto all the charges. The charges against Combs and each verdict were: The prostitution-related charges allege violations of the Mann Act, a law that makes it a federal crime to transport someone across state lines for prostitution. Before jurors began their deliberations, Subramanian gave them instructions on how to apply the law to the facts presented during the trial. Jurors were told that, in order to find Combs guilty of the prostitution-related charges, prosecutors must have proven beyond a reasonable doubt that he knowingly transported an individual in ""interstate or foreign commerce"" and intended that the individual ""engage in an act of prostitution."" Subramanian noted that it wasn't necessary for prosecutors to prove that engaging in prostitution was Combs' sole purpose in transporting a person across a state line or foreign border. However, prosecutors needed to prove that a ""significant or motivating purpose"" of the trip was prostitution. The charge of racketeering conspiracy requires prosecutors to prove a number of elements: that there was an agreement among two or more people to participate in a pattern of activity that would affect interstate commerce; that the defendant willfully joined it; and that members of the conspiracy committed two or more racketeering acts. The charging document lists a number of alleged racketeering acts, including kidnapping, bribery, sex trafficking and forced labor. Prosecutors alleged that Combs' business empire created a criminal enterprise that he used for years to cover up acts of violence and abuse and to coerce women into fulfilling his sexual desires. Jurors heard from more than 30 witnesses over the course of seven weeks as the prosecution went through its case. Combs denied the accusations butchose not to take the standto testify in his defense. His attorneys did not call any witnesses during the trial, though they did conduct extensive cross-examinations of the government's witnesses. Combs' lawyers argued the prosecution failed to prove the charges beyond a reasonable doubt. The high-profile trial, whichstarted in May, included graphic and emotional testimony from two of Combs' former girlfriends. Ventura, who spent more than a decade with him, testified about drug-fueled sex sessions that Combs allegedly referred to as ""freak-offs."" Ventura testified that he directed all the encounters, which could last for days, and that she felt forced to participate to make him happy. Ventura testifiedthat Combs controlled every aspect of her life, and that she often did things out of fear, since physical abuse was ""frequent."" Combs' attorneys argued that the encounters were consensual. Duringcross-examination, the defense showed the jury a 2009 message from Ventura to Combs that read, ""I'm always ready to freak off."" Ventura also testified about a 2016 incident which was caught onsurveillance videoshowing Combs beating and kicking her in a California hotel hallway. Combs apologized at the time, saying his behavior was ""inexcusable"" and that he took ""full responsibility"" for his actions. Ventura testified that the attack happened as she was trying to leave a ""freak-off"" that had turned violent. A former hotel security officer testified that Combs offered him cash after the attack, which the officer said he understood to be a bribe. Ventura had filed a civil lawsuit against Combs in 2023, accusing him of physically and sexually abusing her. Combs denied the claims and quicklyreached a settlementwith her. In hisclosing argumentto the jury Friday, Agnifilo said, ""If you had to pick a winner in this whole thing, it's hard not to pick Cassie."" Another former girlfriend of Combs testified under the pseudonym ""Jane"" to protect her identity. She told the court she often participated in what she called ""hotel nights,"" which also involved drugs. Jane testified she would have sex with a male escort while Combs watched. She said she told Combs many times that she didn't want to have sex with other men and didn't like the ""hotel nights."" Combs' lawyers displayed messages showing her setting up ""hotel nights."" Jane said shefelt pressuredand that she had grown financially dependent on Combs. In theprosecution's closing arguments, Assistant U.S. Attorney Christy Slavik described Combs as ""the leader of a criminal enterprise. He doesn't take no for an answer. And now you know about many crimes he committed with members of his enterprise."" She said he used a ""small army"" of employees to harm women and then cover it up. ""He thought that his fame, wealth and power put him above the law,"" Slavik said. Agnifilocountered by arguingthat prosecutors ""badly exaggerated"" evidence of a swinger lifestyle and threesomes, combining it with recreational drug use and calling it a racketeering conspiracy. ""He did not do the things he's charged with. He didn't do racketeering conspiracy and sex trafficking,"" Combs' lawyer said. Jericka DuncanandThe Associated Presscontributed to this report. Alex Sundby is a senior editor at CBSNews.com. In addition to editing content, Alex also covers breaking news, writing about crime and severe weather as well as everything from multistate lottery jackpots to the July Fourth hot dog eating contest."
